{
  "formatVersion": 1,
  "id": "essentials",
  "pickerOrder": 1,
  "name": "Essentials",
  "summary": "A focus timer, your to-do list, music, and an AI helper. Add more tabs any time.",
  "symbol": "square.grid.2x2.fill",
  "accent": "planner",
  "modules": ["study", "planner", "spotify", "claudeAsk", "closet"],
  "defaults": {
    "ticker": ["focus", "tasks", "progress", "party", "meeting", "nowPlaying", "pet"],
    "theme": "midnight",
    "moduleSettings": {
      "study": {
        "methods": ["timer", "pomodoro", "fiftyTwoSeventeen", "flowtime", "custom"],
        "method": "timer"
      }
    }
  },
  "onboarding": [
    {
      "id": "day",
      "prompt": "What does your day look like?",
      "allowsMultiple": true,
      "options": [
        { "id": "meetings", "label": "Lots of meetings", "symbol": "calendar", "tasks": ["Prep for today's first meeting"] },
        { "id": "deep-work", "label": "Long stretches of deep work", "symbol": "brain.head.profile", "tasks": ["Block out one deep-work session"] },
        { "id": "code", "label": "Mostly coding", "symbol": "chevron.left.forwardslash.chevron.right", "tasks": ["Ship one small change"] },
        { "id": "classes", "label": "Classes and homework", "symbol": "graduationcap", "tasks": ["Review today's lecture notes"] }
      ]
    }
  ],
  "starterTasks": []
}
