{
  "formatVersion": 1,
  "id": "productivity",
  "name": "Productivity",
  "summary": "Music, system stats, your day, and Claude, one glance away.",
  "symbol": "briefcase.fill",
  "modules": ["spotify", "system", "claudeUsage", "planner", "claudeAsk"],
  "defaults": {
    "focusSounds": [{ "sound": "brown", "level": 1 }],
    "theme": "notch"
  },
  "onboarding": [
    {
      "id": "work",
      "prompt": "What does your day look like?",
      "options": [
        { "id": "meetings", "label": "Lots of meetings", "symbol": "calendar" },
        { "id": "deep-work", "label": "Long stretches of deep work", "symbol": "brain.head.profile" },
        { "id": "code", "label": "Mostly coding", "symbol": "chevron.left.forwardslash.chevron.right" }
      ]
    }
  ],
  "starterTasks": []
}
