{
  "formatVersion": 1,
  "id": "productivity",
  "pickerOrder": 1,
  "name": "Productivity",
  "summary": "Music, system stats, your day, and Claude, one glance away.",
  "symbol": "briefcase.fill",
  "modules": ["spotify", "system", "claudeUsage", "planner", "claudeAsk"],
  "defaults": {
    "theme": "midnight"
  },
  "onboarding": [
    {
      "id": "work",
      "prompt": "What does your day look like?",
      "allowsMultiple": true,
      "options": [
        { "id": "meetings", "label": "Lots of meetings", "symbol": "calendar", "tasks": ["Prep for today's first meeting"] },
        { "id": "deep-work", "label": "Long stretches of deep work", "symbol": "brain.head.profile", "tasks": ["Block out one deep-work session"] },
        { "id": "code", "label": "Mostly coding", "symbol": "chevron.left.forwardslash.chevron.right", "tasks": ["Ship one small change"] }
      ]
    }
  ],
  "starterTasks": []
}
